{
  "$schema": "https://json-schema.org/draft/2020-12/schema",
  "type": "object",
  "required": [
    "id",
    "version",
    "system",
    "developer",
    "user_template",
    "variables",
    "guardrails",
    "few_shots",
    "eval"
  ],
  "properties": {
    "id": {
      "type": "string"
    },
    "version": {
      "type": "string"
    },
    "system": {
      "type": "string"
    },
    "developer": {
      "type": "string"
    },
    "user_template": {
      "type": "string"
    },
    "variables": {
      "type": "array",
      "items": {
        "type": "string"
      }
    },
    "guardrails": {
      "type": "array",
      "items": {
        "type": "string"
      }
    },
    "few_shots": {
      "type": "array",
      "items": {
        "type": "object",
        "required": [
          "input",
          "output"
        ],
        "properties": {
          "input": {
            "type": "string"
          },
          "output": {
            "type": "string"
          }
        }
      }
    },
    "eval": {
      "type": "object",
      "required": [
        "must_include",
        "must_not_include"
      ],
      "properties": {
        "must_include": {
          "type": "array",
          "items": {
            "type": "string"
          }
        },
        "must_not_include": {
          "type": "array",
          "items": {
            "type": "string"
          }
        }
      }
    }
  }
}